{
    "$schema": "https://json-schema.org/draft-07/schema#",
    "title": "DnD Subclass",
    "description": "",
    "type": "object",
    "properties": {
        "id": {
            "type": "string",
            "pattern": "^subclass_[a-z0-9_]+$",
            "description": "Unique identifier for the subclass."
        },
        "name": {
            "type": "string"
        },
        "parentClassId": {
            "type": "string",
            "description": "The Id of the base class this belongs to (e.g., 'class_rogue')"
        },
        "progression": {
            "type": "array",
            "description": "An ordered list of subclass progression entries. Include only levels where this subclass grants features.",
            "items": {
                "type": "object",
                "properties": {
                    "level": {
                        "type": "integer",
                        "minimum": 1,
                        "maximum": 20,
                        "description": "The character level this subclass entry applies to (1-20)."
                    },
                    "features": {
                        "type": "array",
                        "items": {
                            "type": "string"
                        },
                        "description": "Trait IDs granted at this specific level."
                    },
                    "subclassSpecificScaling": {
                        "type": "object",
                        "description": "Subclass scaling key-value pairs where each key maps to a scalar value. During runtime resolution, entries from higher character levels override lower-level values for the same key. Known stat keys currently consumed by useCharacterStats include: initiative, initiative_bonus, ac, armor_class, speed.",
                        "additionalProperties": {
                            "type": [
                                "string",
                                "integer",
                                "number"
                            ]
                        }
                    },
                    "bonusSpells": {
                        "type": "array",
                        "items": {
                            "type": "string"
                        },
                        "description": "Spell IDs automatically learned or prepared at this level."
                    },
                    "spellsAddedToList": {
                        "type": "array",
                        "items": {
                            "type": "string"
                        },
                        "description": "Spell IDs added to the class spell list for optional selection."
                    }
                },
                "required": [
                    "level",
                    "features"
                ]
            }
        },
        "lore": {
            "type": "object",
            "properties": {
                "shortDescription": {
                    "type": "string",
                    "description": "A quick 1-2 sentence summary for tooltips."
                },
                "fullText": {
                    "type": "string",
                    "description": "The main body of text for the entity."
                },
                "sections": {
                    "type": "array",
                    "description": "Flexible key-value pairs for categorized flavor text (Age, Alignment, Lore, etc.).",
                    "items": {
                        "type": "object",
                        "properties": {
                            "title": {
                                "type": "string"
                            },
                            "body": {
                                "type": "string"
                            }
                        },
                        "required": [
                            "title",
                            "body"
                        ]
                    }
                }
            },
            "required": [
                "shortDescription"
            ]
        }
    },
    "required": [
        "id",
        "name",
        "parentClassId",
        "progression"
    ]
}